URL,Trafico_Mensual,Keyword_Objetivo,H1_Recomendado,Prioridad,Notas
/contacto/,234,contacto ibiza villa,Contacta con Ibiza Villa - Alquiler de Villas de Lujo,Alta,Página institucional con tráfico directo
/sobre-nosotros/,456,agencia alquiler villas ibiza,Sobre Ibiza Villa - Tu Agencia de Confianza desde 2010,Alta,Importante para E-E-A-T
/villas/villa-sunset/,342,villa sunset ibiza,Villa Sunset - Villa de Lujo con Piscina Infinita en San Antonio,Muy Alta,Ficha de propiedad premium
/blog/mejores-playas-ibiza/,523,mejores playas ibiza,Las 15 Mejores Playas de Ibiza para Familias (Guía 2025),Muy Alta,Alto tráfico orgánico
/villas/ibiza-centro/villa-moderna/,287,villa moderna ibiza centro,Villa Moderna en Ibiza Centro - 4 Habitaciones con Vistas al Mar,Alta,Propiedad bien posicionada
/zonas/santa-eulalia/,412,santa eulalia ibiza,Santa Eulalia - Guía Completa de la Zona Más Tranquila de Ibiza,Muy Alta,Guía de zona con buen tráfico
/servicios/gestion-propiedades/,198,gestión propiedades ibiza,Gestión Integral de Propiedades en Ibiza - Servicios Completos,Media,Servicio B2B
/faq/,678,preguntas alquiler villa ibiza,Preguntas Frecuentes - Todo sobre Alquilar una Villa en Ibiza,Muy Alta,Alta conversión a contactos
/villas/compra/villa-nueva-construccion/,156,villa nueva construcción ibiza,Villa de Nueva Construcción en Venta - Diseño Contemporáneo,Media,Segmento compra
/blog/eventos-ibiza-2025/,445,eventos ibiza 2025,Calendario de Eventos en Ibiza 2025 - Fiestas y Festivales,Alta,Contenido estacional
